{
  "$schema": "https://stack-chan.github.io/stack-chan/web/schemas/stackchan-mod.schema.json",
  "format": "tech.stackchan.mod",
  "schemaVersion": 2,
  "id": "tech.stackchan.samples.block-hello",
  "version": "1.0.0",
  "type": "block",
  "name": "あいさつと表情",
  "description": "起動時に笑顔と吹き出しを表示し、Aボタンを押すと話します。",
  "author": "Stack-chan Community",
  "license": "Apache-2.0",
  "source": {
    "path": "hello.stackchan-blocks.json"
  },
  "targets": ["m5stackchan-cores3"],
  "capabilities": ["audio.speech", "face", "input.primary", "ui.controls"],
  "appApiVersion": 2,
  "hostApiVersion": 8,
  "optionalCapabilities": [],
  "entrypoints": ["mod"]
}
