{
  "format": "tech.stackchan.mod",
  "schemaVersion": 2,
  "id": "tech.stackchan.examples.pose-sharing",
  "version": "1.0.0",
  "type": "text",
  "name": "pose_sharing",
  "description": "Advertise or follow robot poses over DNS-SD.",
  "appApiVersion": 2,
  "hostApiVersion": 7,
  "source": {
    "path": "manifest.json",
    "entrypoint": "mod.ts"
  },
  "targets": ["m5stackchan-cores3", "stackchan-rt", "takao-core2-sg90"],
  "capabilities": ["ui.controls", "network.dnssd", "motion"],
  "entrypoints": ["mod"],
  "optionalCapabilities": ["network.dnssd", "motion"]
}
