{
  "format": "tech.stackchan.mod",
  "schemaVersion": 2,
  "id": "tech.stackchan.lessons.01-face",
  "version": "1.0.0",
  "type": "text",
  "name": "顔を動かす",
  "description": "Stack-chan SDK 世代2の入門教材。顔を動かす操作を学びます。",
  "source": {
    "path": "manifest.json",
    "entrypoint": "mod.js"
  },
  "appApiVersion": 2,
  "hostApiVersion": 2,
  "targets": ["portable"],
  "capabilities": ["face"],
  "optionalCapabilities": [],
  "entrypoints": ["mod"]
}
