{
  "format": "tech.stackchan.mod",
  "schemaVersion": 2,
  "id": "tech.stackchan.examples.face",
  "version": "1.0.0",
  "type": "text",
  "name": "face",
  "description": "Legacy API 1 example; see docs/architecture/legacy-mod-migration.md for migration and hardware prerequisites.",
  "appApiVersion": 1,
  "hostApiVersion": 1,
  "source": {
    "path": "manifest.json",
    "entrypoint": "mod.js"
  },
  "targets": ["portable"],
  "capabilities": ["face", "ui.effects"],
  "entrypoints": ["mod"]
}
